week,section,Details
Weeks 1–4,Symptoms,"During the first four weeks of pregnancy, many women experience a range of early symptoms driven by rapid hormonal changes. Morning sickness can manifest as nausea and vomiting at any time of day, not just in the morning. Fatigue often sets in early, creating an increased need for rest and naps. Breast tenderness and swelling may occur as estrogen and progesterone levels rise. Frequent urination is common, caused by hormonal effects on bladder function and increased blood volume. Changes in taste and smell can lead to food aversions or cravings, sometimes very suddenly, while mood swings arise from fluctuating hormone levels. Symptoms vary widely in type and intensity, and some women may barely notice any of these signs while others find them more pronounced."
Weeks 1–4,Doctor Visits,"Pregnancy is typically first confirmed at home with an over‑the‑counter urine test or via a blood test ordered by a healthcare provider. While most women do not have an in‑office visit during the very first month, some choose to schedule an early consultation—especially if they experience concerning symptoms like bleeding or pelvic pain, or simply for reassurance. This initial visit may include discussion of medical history, lifestyle advice, and planning for future prenatal care."
Weeks 1–4,Tests,"The definitive test in early pregnancy is the pregnancy test itself, which can be done at home with a urine kit or in a clinical setting via a serum (blood) test. Home tests are often used as soon as a period is missed or pregnancy is suspected, while blood tests provide a more sensitive confirmation and can detect pregnancy slightly earlier."
Weeks 1–4,Medication,"Standard early‑pregnancy supplementation includes a prenatal vitamin containing folic acid, iron, calcium, and other key micronutrients to support maternal health and fetal development. Folic acid is especially critical in the first month to help prevent neural tube defects. For women experiencing moderate to severe morning sickness, a healthcare provider may recommend vitamin B6 or a prescription anti‑nausea medication such as Diclegis. All additional medications should be taken under medical supervision."
Weeks 1–4,Recommended Actions,"Gentle physical activity—such as walking, swimming, or prenatal yoga—is encouraged, aiming for about 150 minutes of moderate exercise per week, spread evenly and avoiding high‑impact or uncomfortable movements. A balanced, nutrient‑dense diet rich in whole foods (fruits, vegetables, lean proteins, whole grains, and healthy fats) supports early development; special focus should be on folic acid–rich foods like leafy greens, fortified cereals, and citrus fruits, along with adequate hydration (8–10 cups of water daily). Avoid raw seafood, undercooked meats, unpasteurized dairy, excessive caffeine, and sugary snacks. Incorporate gentle stretching or short walks throughout the day, listening to your body and resting when needed. Finally, schedule your first prenatal care appointment as you feel ready, monitor any ongoing symptoms, and steer clear of alcohol, tobacco, and environmental toxins."
Weeks 5–8,Symptoms,"Between weeks five and eight, many early‑pregnancy symptoms continue and a few new ones may appear. Morning sickness often persists—nausea and vomiting can still occur throughout the day, although it may ease for some by week eight. Fatigue can become more pronounced as the body adapts to hormonal shifts. Breast tenderness and swelling typically intensify, and frequent urination may continue as the growing uterus presses on the bladder. Food aversions and cravings can deepen, with certain smells or tastes provoking stronger reactions. Mood swings remain common due to ongoing hormonal fluctuations. New digestive symptoms such as heartburn or indigestion may surface, and the slowing of the digestive tract can lead to constipation. Individual experiences vary: while some symptoms begin to subside by the end of this period, others may persist or worsen."
Weeks 5–8,Doctor Visits,"The first official prenatal appointment usually takes place between six and eight weeks. During this visit, pregnancy is confirmed via a blood test, and a series of routine blood screenings are performed—blood type and Rh factor, complete blood count (CBC), and tests for HIV, hepatitis B, and syphilis. An initial ultrasound is also often scheduled in this window to verify fetal heartbeat, assess viability, and establish an estimated due date. This comprehensive first visit lays the groundwork for ongoing prenatal care."
Weeks 5–8,Tests,"Routine laboratory tests include blood‑type and Rh‑factor determination (with Rh immunoglobulin planning if needed), CBC to check for anemia or infection, and infectious‑disease screenings (HIV, syphilis, hepatitis B). A urine test screens for urinary tract infections and checks protein levels, which could signal preeclampsia or kidney concerns. Typically one ultrasound is performed between weeks six and eight to confirm the heartbeat and dating; further ultrasounds may follow only if clinically indicated. Depending on maternal age or family history, non‑invasive prenatal testing (NIPT) or other genetic screening such as chorionic villus sampling (CVS) may be offered during this period."
Weeks 5–8,Medication,"Continue daily prenatal vitamins rich in folic acid, iron, calcium, and other essential nutrients to support maternal health and fetal development. Ongoing folic acid supplementation remains critical for neural‑tube support. Women who still experience significant nausea may be prescribed vitamin B6 or antinausea medications like Diclegis. For those suffering from heartburn or indigestion, over‑the‑counter antacids (e.g., calcium‑carbonate tablets) can be recommended. All additional medications should follow a healthcare provider’s guidance."
Weeks 5–8,Recommended Actions,"Maintain gentle, low‑impact exercise—walking, swimming, or prenatal yoga—with added light stretching for flexibility and relaxation, while steering clear of contact sports and heavy lifting. Continue a balanced diet emphasizing lean proteins, iron‑rich foods (spinach, beans), and frequent, small meals to help manage nausea; stay well‑hydrated and limit caffeine and unpasteurized products. Incorporate regular, moderate movement daily, listening to your body’s signals and resting when needed. Keep tracking any ongoing symptoms—nausea, fatigue, heartburn—and reach out to your healthcare provider if you have concerns about severity or new complications."
Weeks 9–12,Symptoms,"As you approach the end of the first trimester, many early symptoms persist while others begin to ease. Morning sickness may still affect some women, though it often starts improving by week 12. Fatigue can continue, but you may notice a gradual uptick in energy as your body adapts. Breast tenderness remains common, sometimes lessening slightly as hormone levels stabilize. Frequent urination may persist, though a slight reduction can occur as the uterus shifts. Food aversions and cravings often stay strong, and mood swings may continue with ongoing hormonal changes. Digestive issues such as heartburn or indigestion can linger, and slowed gut motility may lead to constipation. You may also notice an increase in clear or milky vaginal discharge, a normal effect of increased pelvic blood flow."
Weeks 9–12,Doctor Visits,"Your second prenatal appointment typically falls between ten and twelve weeks. If you haven’t yet had an ultrasound, one may be scheduled during this visit to assess fetal growth, confirm viability, and refine your due‑date estimate. Your provider will review any prior lab results and order follow‑up tests as needed—such as a repeat anemia screen or additional ultrasounds if concerns arise—ensuring close monitoring of both your health and the baby’s development."
Weeks 9–12,Tests,"Anemia screening may be repeated now if earlier results indicated low iron levels or if you carry other risk factors. A transvaginal or abdominal ultrasound is usually performed between weeks nine and twelve to evaluate fetal anatomy, heartbeat, and overall growth; if you missed the initial scan at six to eight weeks, this will serve as your first. Genetic screening options such as non‑invasive prenatal testing (NIPT) or chorionic villus sampling (CVS) may be offered during this window for early detection of conditions like Down syndrome, with follow‑up testing based on individual risk and prior results."
Weeks 9–12,Medication,"Continue daily prenatal vitamins containing folic acid, iron, calcium, and other essential nutrients throughout the first trimester. If nausea persists, vitamin B6 or prescription anti‑nausea medications may remain part of your regimen. For heartburn or indigestion, over‑the‑counter antacids (e.g., calcium‑carbonate tablets) are commonly used. Should constipation worsen, your provider may recommend fiber supplements or stool softeners. Always take any additional medications under medical guidance."
Weeks 9–12,Recommended Actions,"Maintain regular, moderate exercise—walking, swimming, prenatal yoga—and, if you feel comfortable, introduce light strength‑training moves. Continue nourishing your body with a balanced, nutrient‑dense diet rich in iron‑bearing foods, and keep hydration levels up by drinking 8–10 cups of water each day. Small, frequent meals can help manage lingering nausea and curb aversions. Stick with gentle daily movement to support flexibility and circulation, avoiding high‑impact or strenuous activities. Finally, uphold your prenatal appointments, track any new or changing symptoms (such as discharge or constipation), and practice relaxation techniques to manage stress as you transition into your second trimester."
Weeks 1–12,Symptoms Summary,"In the first four weeks of pregnancy, many women experience mild to moderate signs such as morning sickness, fatigue, breast tenderness, frequent urination, food aversions or cravings, and mood swings. As you move into weeks 5–8, those early symptoms often intensify—nausea and tiredness may be more pronounced—and new issues like heartburn or constipation can emerge. By weeks 9–12, morning sickness begins to improve for many, though fatigue, breast soreness, and cravings or aversions can persist. You might also notice increased clear or milky vaginal discharge, and digestive discomfort such as heartburn or constipation may continue through the end of the first trimester."
Weeks 1–12,Doctor Visits Summary,"During the first month (weeks 1–4), most women skip an in‑office appointment unless symptoms like bleeding or severe pain prompt an early check‑in. The first official prenatal visit is scheduled around weeks 6–8, when a blood test confirms pregnancy, routine bloodwork and infectious‑disease screens are drawn, and an ultrasound verifies the fetal heartbeat and estimates a due date. A follow‑up visit around weeks 10–12 focuses on continued monitoring: you may have another ultrasound if needed, repeat blood or urine tests, and any additional screenings based on earlier results."
Weeks 1–12,Medication Summary,"From the moment pregnancy is confirmed, daily prenatal vitamins containing folic acid, iron, calcium, and other essential nutrients should be continued throughout the first trimester. In the early weeks (1–4), folic acid is critical for neural‑tube development, and anti‑nausea medications may be prescribed if morning sickness is severe. Between weeks 5–8, these supplements remain, and providers may add treatments for heartburn or more potent anti‑nausea drugs as needed. Into weeks 9–12, supplementation continues, with the possible addition of fiber supplements or stool softeners if constipation worsens, and ongoing nausea or heartburn management as symptoms dictate."
Weeks 1–12,Recommended Actions Summary,"Maintain gentle, low‑impact exercise—such as walking, swimming, or prenatal yoga—throughout the first trimester, avoiding high‑risk activities and heavy lifting. Nourish your body with a balanced diet rich in whole foods, prioritizing iron‑ and folic‑acid–rich choices, and drink at least 8–10 cups of water each day. In the early weeks, focus on moderate activity and rest as needed; during weeks 5–8, incorporate light stretching and strategies to ease nausea or heartburn; and by weeks 9–12, you can introduce light strength‑training moves if comfortable. Throughout, listen to your body, monitor any emerging symptoms, and consult your provider with any concerns."
Weeks 1–12,Tests Summary,"Pregnancy is first confirmed in weeks 1–4 via a home urine test or clinical blood test. At the 6–8‑week visit, routine labs include blood‑type and Rh‑factor determination, a complete blood count, HIV/syphilis/hepatitis B screens, and a urine analysis; this appointment also features the first ultrasound to confirm fetal viability and date the pregnancy. Genetic screening options—like non‑invasive prenatal testing (NIPT) or CVS—may be offered based on age or family history. Around weeks 9–12, follow‑up testing may include a repeat anemia screen, a second ultrasound (if not yet performed), and any additional genetic tests if indicated by earlier results."
Weeks 13–16,Symptoms,"As you settle into the early second trimester, many first-trimester discomforts begin to ease while new changes emerge. Fatigue, frequent urination, breast tenderness, food cravings, and occasional nausea often continue but may diminish. You’ll likely notice a visible baby bump as your uterus expands, along with skin changes such as darker nipples and the appearance of the linea nigra. Appetite typically increases, and mood swings can still occur. Round-ligament pain may cause sharp twinges in your lower abdomen as supporting ligaments stretch. Progesterone-driven muscle relaxation often leads to gas and bloating, and back pain can arise from the extra weight and weakened core muscles. Breasts may grow fuller, veins more prominent, and areolas darker. “Pregnancy brain” moments of forgetfulness and mild headaches—triggered by hormonal shifts, dehydration, or stress—are also common."
Weeks 13–16,Doctor Visits,"You’ll continue routine prenatal appointments every four weeks. At each visit, your provider will monitor your weight, blood pressure, and urine for signs of complications like gestational diabetes or urinary tract infection. Around this time, a detailed ultrasound may be performed to assess fetal growth, placental health, and amniotic-fluid levels. Your doctor may review or recommend genetic screening options based on earlier results or personal risk. Always reach out between appointments if you experience heavy bleeding, severe pain, sudden headaches, vision changes, or any concerning symptoms."
Weeks 13–16,Tests,"Blood tests now typically include anemia screening—checking hemoglobin and iron levels—and in some practices, a gestational-diabetes screen. Genetic screening (such as NIPT) may be offered if not completed earlier or if further risk assessment is needed. An anatomy ultrasound around week 16 evaluates baby’s size and development, placental position, and fluid volume, helping ensure everything is progressing normally."
Weeks 13–16,Medication,"Continue daily prenatal vitamins containing folic acid, iron, calcium, and other key nutrients. If your bloodwork shows low iron, your provider may prescribe or adjust an iron supplement to prevent or treat anemia. Anti-nausea medications remain an option if morning sickness persists. Any treatments for underlying conditions—such as thyroid medication—will be carefully managed for pregnancy safety."
Weeks 13–16,Recommended actions,"Building on your established routine, these weeks emphasize core strength, back support, and gearing up for mid-trimester screenings. Continue low-impact activities such as walking, swimming, and prenatal yoga. Begin gentle core and pelvic-floor exercises to support growing weight, and incorporate specific stretches for round-ligament pain and lower-back relief. Avoid heavy lifting and prolonged standing, and use a maternity support belt if needed. Increase balanced calories to accommodate baby’s growth by adding lean proteins, healthy fats, and whole grains. Include magnesium-rich foods like nuts and seeds to ease leg cramps, and maintain 8–10 cups of water daily; small, frequent meals help manage any residual nausea. Be sure to add fiber-rich fruits and vegetables to prevent constipation. Use prenatal-safe moisturizer and gentle massage on areas prone to stretch marks. Elevate legs when sitting to reduce swelling and varicose-vein discomfort, and practice relaxation and breathing exercises to combat pregnancy headaches. Adjust sleep positions with pillows under your belly and between your knees for added comfort. Attend the 16-week detailed ultrasound if scheduled, and complete any follow-up bloodwork. Confirm timing for gestational-diabetes screening around week 24, and discuss any persistent or new symptoms—such as headaches, dizziness, or unusual pain—with your care provider."
Weeks 17–20,Symptoms,"By mid-second trimester, many women feel a burst of energy even as some earlier symptoms linger: fatigue, frequent urination, breast tenderness, cravings, and occasional nausea. Your belly’s growth accelerates, and skin changes continue (linea nigra, darker areolas). You may feel the first flutter of baby movements (“quickening”), and hormonal shifts can cause nasal congestion or mild nosebleeds. Increased blood volume sometimes leads to varicose veins in the legs. Digestive issues—heartburn and indigestion—may worsen as your uterus presses on your stomach. Back pain from added weight and changing posture is common, and you might notice new stretch marks on your belly, thighs, or breasts."
Weeks 17–20,Doctor Visits,"Prenatal check-ups remain every four weeks. Your provider will check weight, blood pressure, urine, and listen for the baby’s heartbeat. Around week 20, you’ll have the detailed anatomy scan—an ultrasound that examines the baby’s organs, limbs, and overall development. Blood work may include monitoring iron levels and planning for the glucose-tolerance test (typically done around week 24). Fundal-height measurements track uterine growth, and your doctor will review any genetic-screening results and advise on next steps. Contact your provider between visits for severe headaches, vision changes, sudden swelling, intense pain, or UTI symptoms."
Weeks 17–20,Tests,"While the formal gestational-diabetes glucose-tolerance test usually occurs near week 24, iron levels and anemia screens may be repeated now if needed. The 20-week anatomy ultrasound provides a comprehensive look at fetal growth and structure, and if you haven’t yet had a second-trimester genetic screen (e.g., quad screen), this is often the time it’s offered to assess risks for conditions like Down syndrome or spina bifida."
Weeks 17–20,Medication,"Keep taking your prenatal vitamins with folic acid, iron, and calcium. Continue any prescribed iron supplements for anemia. Anti-nausea medications remain available if needed. If gestational diabetes is diagnosed, your doctor may prescribe insulin or safe oral medications to manage blood sugar. All ongoing prescriptions for chronic conditions will be adjusted as necessary to maintain safety for you and baby."
Weeks 17–20,Recommended Actions,"During these weeks, as you feel your energy returning and baby “flutters” emerge, maintain a moderate exercise routine that includes gentle strength­-training with light resistance bands, prenatal Pilates or stability-ball workouts, and continued pelvic-floor and core-stabilization exercises to support posture. Remember to take frequent breaks if you’re on your feet for long periods and choose supportive footwear. Nutritionally, prioritize iron-rich foods such as lean meats, spinach, and beans to keep up with increasing blood volume, and carry water with you to stay well-hydrated—this can help manage Braxton Hicks contractions and reduce muscle cramps. Small, nutrient-dense snacks before bedtime (for example, yogurt with fruit) may alleviate nighttime leg cramps. For symptom relief, monitor any Braxton Hicks tightenings—changing position or resting often eases discomfort—and use a humidifier or saline nasal spray to combat nasal congestion. Elevate your feet when possible and consider compression socks if swelling or varicose veins worsen. Applying warm packs and practicing gentle back stretches can help soothe lower-back aches. Finally, prepare for your mid-trimester appointments by completing the 20-week anatomy ultrasound, following up on any outstanding genetic or quad-screen tests, and discussing gestational-diabetes screening options and timing with your provider."
Weeks 21–24,Symptoms,"By mid-second trimester, many early signs continue—fatigue, frequent urination, breast tenderness, food cravings, a growing bump, skin changes (linea nigra, darkened areolas), and occasional mood swings. New developments often include your belly button beginning to protrude as your uterus expands, and a slightly faster heartbeat as blood volume increases. You may experience mild, irregular Braxton Hicks contractions—gentle tightenings of the uterus that aren’t painful but signal your body preparing for later labor. Stretch marks may appear on your abdomen, thighs, or breasts; leg cramps, especially at night; and difficulty finding a comfortable sleeping position as your belly grows. Fluid retention can lead to mild swelling in your ankles, feet, and hands."
Weeks 21–24,Doctor Visits,"Routine prenatal check-ups remain on a four-week schedule. At each visit, your provider will measure weight, blood pressure, and urine, and listen to the baby’s heart tones. Fundal-height measurements track uterine growth against expectations for this stage. If you missed the detailed 20-week anatomy scan, it may occur now to assess fetal structure and placental health. A glucose screening—often scheduled around week 24—is typically ordered to check for gestational diabetes. Between visits, contact your doctor if you notice sudden swelling in your face or hands, severe abdominal pain, vision changes, or signs of preterm labor (regular contractions or fluid leakage)."
Weeks 21–24,Tests,"Bloodwork during this window focuses on iron levels and anemia screening, ensuring you maintain adequate hemoglobin as baby grows. If not yet performed, the glucose-tolerance test around week 24 screens for gestational diabetes. The anatomy ultrasound—ideally done at 20 weeks—can be completed now if earlier scheduling wasn’t possible; this scan evaluates organ development, checks for birth defects, and confirms fetal growth and placental position. These tests together help monitor your health and detect conditions that may require intervention."
Weeks 21–24,Medication,"Continue your daily prenatal vitamins with folic acid, iron, calcium, and other essential nutrients. Maintain iron supplementation if prescribed to prevent or treat anemia. Anti-nausea medications remain an option if needed, though nausea often eases by now. Should you develop gestational diabetes, your provider may recommend insulin or safe oral medications to maintain blood-sugar control. Any longstanding prescriptions for chronic conditions will be adjusted as needed to ensure safety for both you and your baby."
Weeks 21–24,Recommended Actions,"As you near the halfway mark, continue low-impact cardio and gentle strength exercises—swimming, prenatal barre, or walking are excellent choices—and refine your sleep setup by using pregnancy pillows and adopting a side-lying position to stay comfortable. Incorporate pelvic-tilt and hamstring stretches before bed to help prevent leg cramps. In terms of nutrition, follow a balanced meal plan rich in complex carbohydrates and lean proteins to stabilize blood sugar, and complete the glucose-tolerance test around week 24 so you can adjust your diet based on the results. Keep fiber-rich snacks like legumes on hand, and maintain your prenatal-vitamin, iron, and calcium regimen as prescribed. Continue to monitor your body closely: watch for sudden swelling in your face or hands, track any regular contractions or fluid leakage, and report signs of preterm labor immediately. Moisturize your skin daily to support elasticity as stretch marks develop, and stay cool in loose clothing—cool compresses can help relieve swollen ankles. At each four-week appointment, have your fundal height and fetal heart tones measured, review your anatomy-scan findings, and undergo any repeat bloodwork for anemia or gestational-diabetes management. Use these visits to ask about upcoming third-trimester preparations and clarify any remaining questions about comfort measures and birth planning."

